197687,Fugane Kaoru,Marketing Director,ERA REALTY NETWORK PTE LTD,http://www.stproperty.sg/property-agent/fugane-kaoru/user/197687,+65 9669 9962
307734,FUI CHIEN CAITLIN TAN,-,DENNIS WEE REALTY PTE LTD,http://www.stproperty.sg/property-agent/fui-chien-caitlin-tan/user/307734,+65 9834 9798
318876,FUN THO YONG,-,ERA REALTY NETWORK PTE LTD,http://www.stproperty.sg/property-agent/fun-tho-yong/user/318876,+65 9696 9033
284331,Fun Yuen Mun Veronica,Salesperson,LING MARKETING SERVICES,http://www.stproperty.sg/property-agent/fun-yuen-mun-veronica/user/284331,+65 9758 9844
286805,Fura Ash,Associate Marketing Director,PROPNEX REALTY PTE LTD,http://www.stproperty.sg/property-agent/fura-ash/user/286805,+65 9222 2921
289352,Furness Sng,-,C & H PROPERTIES PTE LTD,http://www.stproperty.sg/property-agent/furness-sng/user/289352,+65 8181 9196
296351,FUT TENG ANDREW WANG,-,HSR INTERNATIONAL REALTORS PTE LTD,http://www.stproperty.sg/property-agent/fut-teng-andrew-wang/user/296351,+65 9671 2125
311539,Fu Yang (Wen Fuyang) Wan,-,PRESTIGE REALTY GLOBAL PTE LTD,http://www.stproperty.sg/property-agent/fu-yang-%28wen-fuyang%29-wan/user/311539,+65 9168 6888
325162,Fyn Kwok,Associate Manager,DENNIS WEE REALTY PTE LTD,http://www.stproperty.sg/property-agent/fyn-kwok/user/325162,+65 9126 3219
